{
  "$schema": "https://raw.githubusercontent.com/Azure/azure-devtestlab/master/schemas/2015-01-01/dtlArtifacts.json",
  "title": "Restart machine",
  "description": "Restarts the machine",
  "tags": [
    "Windows"
  ],
  "iconUri": "",
  "targetOsType": "Windows",
  "parameters": {
  },
  "runCommand": {
    "commandToExecute": "['powershell.exe -executionpolicy bypass -File Restart.ps1']"
  }
}