{
  "$schema": "https://raw.githubusercontent.com/Azure/azure-devtestlab/master/schemas/2015-01-01/dtlArtifacts.json",
  "title": "Add admin user",
  "description": "Creates a new admin user and adds it to the administrator group",
  "tags": [
    "Windows"
  ],
  "iconUri": "",
  "targetOsType": "Windows",
  "parameters": {
    "Username": {
      "type": "string",
      "displayName": "Username",
      "description": "Username",
      "defaultValue": ""
    },
    "Password": {
      "type": "securestring",
      "displayName": "Password",
      "description": "Password",
      "defaultValue": ""
    }
  },
  "runCommand": {
    "commandToExecute": "[concat('powershell.exe -executionpolicy bypass -File CreateAdminUser.ps1 ', parameters('Username'), ' ', parameters('Password'))]"
  }
}