{
  "$schema": "https://raw.githubusercontent.com/Azure/azure-devtestlab/master/schemas/2015-01-01/dtlArtifacts.json",
  "title": "Wireshark",
  "description": "Installs wireshark - network trace utility",
  "tags": [
    "Wireshark",
    "PCAP",
    "Trace"
  ],
    "iconUri": "https://upload.wikimedia.org/wikipedia/commons/d/db/Wireshark_Icon.png",
  "targetOsType": "Windows",
  "runCommand": {
    "commandToExecute": "[concat('powershell.exe -ExecutionPolicy bypass \"& ./startChocolatey.ps1 -PackageList ''', 'wireshark', '''\"')]"
  }
}