{
    "$schema": "https://raw.githubusercontent.com/Azure/azure-devtestlab/master/schemas/2015-01-01/dtlArtifacts.json",
    "title": "Visual Studio Code",
    "description": "Installs Visual Studio Code",
    "tags": [
        "Windows",
        "VSCode",
        "Visual Studio"
    ],
    "iconUri": "https://github.com/Azure/azure-devtestlab/raw/drwill/vscode/Artifacts/windows-vscode/vscode%20icon.png",
    "targetOsType": "Windows",
    "runCommand": {
        "commandToExecute": "powershell.exe -ExecutionPolicy bypass -File installVSCode.ps1"
    }
}