{
    "$schema": "https://raw.githubusercontent.com/Azure/azure-devtestlab/master/schemas/2015-01-01/dtlArtifacts.json",
    "title": "Microsoft .Net Framework 4.5",
    "description": "Installs Microsoft .Net Framework 4.5 using the Chocolatey package manager",
    "tags": [
        "Windows",
        "Fiddler"
    ],
    "iconUri": "https://raw.githubusercontent.com/Azure/azure-devtestlab/master/Artifacts/windows-dotnet45/dotnet.png",
    "targetOsType": "Windows",
    "runCommand": {
        "commandToExecute": "powershell.exe -executionpolicy bypass -File startChocolatey.ps1 -PackageList dotnet45"
    }
}