{
    "$schema": "https://raw.githubusercontent.com/Azure/azure-devtestlab/master/schemas/2016-11-28/dtlArtifacts.json",
    "title": "JDK",
    "description": "Install Java Development Kit on Debian-based and Red Hat based distributions.",
    "tags": [
      "JDK",
      "Linux",
      "JAVA"
    ],
    "iconUri": "https://upload.wikimedia.org/wikipedia/en/thumb/3/30/Java_programming_language_logo.svg/128px-Java_programming_language_logo.svg.png",
    "targetOsType": "Linux",
	
  "runCommand": {
    "commandToExecute": "['sh linux_install_jdk.sh']"
  }
}
