{
    "$schema": "https://raw.githubusercontent.com/Azure/azure-devtestlab/master/schemas/2015-01-01/dtlArtifacts.json",
    "title": "Sublime Text",
    "description": "Installs SublimeText using the Chocolatey package manager",
    "tags": [
        "Windows",
        "SublimeText"
    ],
    "iconUri": "https://chocolatey.org/content/packageimages/SublimeText3.PackageControl.2.0.0.20140915.png",
    "targetOsType": "Windows",
    "runCommand": {
        "commandToExecute": "powershell.exe -ExecutionPolicy bypass -File startChocolatey.ps1 -PackageList sublimetext3"
    }
}