{
  "$schema": "https://raw.githubusercontent.com/Azure/azure-devtestlab/master/schemas/2015-01-01/dtlArtifacts.json",
  "title": "PowerShell",
  "description": "Installs latest stable PowerShell version  using the Chocolatey package manager",
  "tags": [
    "Windows",
    "Fiddler"
  ],
  "iconUri": "https://raw.githubusercontent.com/Azure/azure-devtestlab/master/Artifacts/windows-powershell/PowerShellLogo.png",
  "targetOsType": "Windows",
  "runCommand": {
    "commandToExecute": "powershell.exe -ExecutionPolicy bypass -File startChocolatey.ps1 -PackageList powershell"

  }
}